{
  "schema_version": 1,
  "kind": "general_sem_rank0_qualification_receipt_payload_v1",
  "contract_id": "quickpls.general_sem.rank0.receipt_payload.v1",
  "qualification_profile_id": "rank0_streamlined_plan4b_v1",
  "passed": true,
  "role": "generative_recovery",
  "stage": "generative",
  "qualification_id": "qpls3.pls.general_sem_multiple_mediation_bootstrap.qualification_v2",
  "capability_cell": {
    "capability_id": "smartpls.mediation",
    "capability_version": "general_sem_pls_full_model_case_bootstrap_v1",
    "cell_id": "qpls3.pls.general_sem_multiple_mediation_bootstrap",
    "registry_schema_version": 2
  },
  "method_version": "general_sem_pls_full_model_case_bootstrap_v1",
  "analytical_method_version": "general_sem_pls_full_model_case_bootstrap_v1",
  "generated_at_utc": "2026-08-20T12:46:50Z",
  "source_descriptors": [
    {
      "path": "Cargo.lock",
      "size": 154646,
      "sha256": "2782f92e86ae7420af0c27210b1602ebf6c5fc1c1002c2f4ad1ed56cdc38dcb7"
    },
    {
      "path": "Cargo.toml",
      "size": 1503,
      "sha256": "7b5cc1ab12cb81475cce1227b7ab1381e6278cc22f3b501c3b80858d9b1c749d"
    },
    {
      "path": "crates/qpls-assessment/Cargo.toml",
      "size": 456,
      "sha256": "22a0cc3da4ada9be1f385495ef7af8354fbdf87baa8a5bac6f3dda891eecb01d"
    },
    {
      "path": "crates/qpls-assessment/src/lib.rs",
      "size": 187841,
      "sha256": "910a3c42edde1db2dcff8b283a9d7acb388b4eb6b30f88c55201624610c2e341"
    },
    {
      "path": "crates/qpls-cli/Cargo.toml",
      "size": 678,
      "sha256": "ede9b7845e6439c9bff5bd05cb07933938a1ad8f82e859e0c3f5676de0119ba8"
    },
    {
      "path": "crates/qpls-cli/src/main.rs",
      "size": 430578,
      "sha256": "20d95dd65f3f157f6eed2ed97e31dac01023ec5425ab187e6991149ccfe14110"
    },
    {
      "path": "crates/qpls-core/Cargo.toml",
      "size": 453,
      "sha256": "f3c060597827e18cb29690adab487f96042c0528fc1010f5077f605b2114968e"
    },
    {
      "path": "crates/qpls-core/src/analysis_recipe_v4.rs",
      "size": 23243,
      "sha256": "d2ca74d949e01d9a5811220a022aa30cc3098cf705e911326c74514b35731d89"
    },
    {
      "path": "crates/qpls-core/src/canonical_result_v2.rs",
      "size": 209456,
      "sha256": "910020fd4fba38fe24153c9280f8b71673f1a4b76130950cc9acb6345bd0898f"
    },
    {
      "path": "crates/qpls-core/src/capability_registry_v2.rs",
      "size": 19248,
      "sha256": "86ce2f425896a1b3faa19436bcdf5633a99c9bd245ff5cdd87ec426f069ded35"
    },
    {
      "path": "crates/qpls-core/src/compiled_cbsem_plan_v2.rs",
      "size": 85511,
      "sha256": "c4572e4448994ebcb28efb8e4e4ba1a5457aa5cd117a1295cd5e558c216b8731"
    },
    {
      "path": "crates/qpls-core/src/compiled_cbsem_plan_v3.rs",
      "size": 34147,
      "sha256": "d3fb3bf027f7936871453875dbc9d777bcd4c23a7640d1310c68f35f62cbdddf"
    },
    {
      "path": "crates/qpls-core/src/compiled_cbsem_product_indicator_v1.rs",
      "size": 57323,
      "sha256": "34cae04ee493a9198cc8f07d5a5397fe99e9ec2df904bd484a255c21a4a653c5"
    },
    {
      "path": "crates/qpls-core/src/compiled_pls_plan_v2.rs",
      "size": 25316,
      "sha256": "e5f9b1521100f5afafae3b9d728291ce3fe52c945d4ca24404e77845bf92904d"
    },
    {
      "path": "crates/qpls-core/src/compiled_pls_plan_v3.rs",
      "size": 53453,
      "sha256": "6edfb1849c361eaaf10847a664cbe42263d3465a3de368e2a9c7078154eb37c6"
    },
    {
      "path": "crates/qpls-core/src/compiled_sem_topology_v1.rs",
      "size": 25115,
      "sha256": "365726d95a4c55aecdc95bdbb2cdb371c3549b4120395dc31a481dc17cd6a783"
    },
    {
      "path": "crates/qpls-core/src/contract.rs",
      "size": 144508,
      "sha256": "51c235a9173d3f9c84e5bfe4c0ce6280268ee26b882e2a41dd01be889a7cdfb5"
    },
    {
      "path": "crates/qpls-core/src/dataset_transformation_v2.rs",
      "size": 119293,
      "sha256": "8a2bfafa9624aae5b6b1a59250cfefd49cb5701e50342a7f3345446934bb85f1"
    },
    {
      "path": "crates/qpls-core/src/general_sem_capability_preflight_v1.rs",
      "size": 60796,
      "sha256": "f109fbd802fbbcd71118c7cd7ff9e459cddee00cedf6fc2d6702b52d24211ef5"
    },
    {
      "path": "crates/qpls-core/src/general_sem_config_v1.rs",
      "size": 37246,
      "sha256": "7e4413b9b5f65b3801a6d58c27e097eeff0fbdc322b6b0508cdd9efc875e3aa5"
    },
    {
      "path": "crates/qpls-core/src/general_sem_effects_v1.rs",
      "size": 33367,
      "sha256": "981f33095efb1682fbbc3a6ade04e6852440974243eb88eade05645e54697874"
    },
    {
      "path": "crates/qpls-core/src/general_sem_recipe_compiler_v1.rs",
      "size": 55284,
      "sha256": "7940c204d78c554b4a4c8d998ebdfc7ddaa2b9514cc80ecdecc8504063a078a0"
    },
    {
      "path": "crates/qpls-core/src/generated/established_method_contracts_v1.rs",
      "size": 7034,
      "sha256": "8c072771933a47073cd35a3016c7e14de9016037295efdc1ed95a5af354b043c"
    },
    {
      "path": "crates/qpls-core/src/lib.rs",
      "size": 1660,
      "sha256": "6a58b77fcc7c3bab1d34ac74493f09f99a43599d334d33a92a7ef98b50750671"
    },
    {
      "path": "crates/qpls-core/src/methods.rs",
      "size": 4404,
      "sha256": "474b1f559b920f2a09d90aa45b2e70f5677fac3fb2b2462efcd24b08ea2a56eb"
    },
    {
      "path": "crates/qpls-core/src/recipe_v4_compiler.rs",
      "size": 126632,
      "sha256": "6f95b03ecfded19f7ccfd41695e6924365229e25f824ac2bcf0c10ee984c44ef"
    },
    {
      "path": "crates/qpls-core/src/roadmap.rs",
      "size": 12376,
      "sha256": "19cf8baad1d217636f3f7ef2d97081156692ed0050561e54bc0bf7b364106fe8"
    },
    {
      "path": "crates/qpls-core/src/sem_capability_decision_v1.rs",
      "size": 30668,
      "sha256": "9d05176c3a7cb83490cfe197fb664c5ff70bf07a2c59ec5451c15e890780a335"
    },
    {
      "path": "crates/qpls-core/src/sem_model_v4.rs",
      "size": 167640,
      "sha256": "2861aec9e74194e22901084fdf63a346593ab4000558e1d968e63f60f69477ac"
    },
    {
      "path": "crates/qpls-core/src/statistics.rs",
      "size": 8527,
      "sha256": "dda4eb9df673b892be963933a3f32b32ade133b5c24c70aae76de3648b063769"
    },
    {
      "path": "crates/qpls-core/src/validation.rs",
      "size": 227427,
      "sha256": "d1a465665a8181c48b50fe822c4c8055ec19b69845ad510f72b7673c103ec306"
    },
    {
      "path": "crates/qpls-core/src/weight_semantics_v1.rs",
      "size": 34172,
      "sha256": "f5fcd290ff6498a99a7fdef16de785d0260856997cddfae6a82d9d292db8df7c"
    },
    {
      "path": "crates/qpls-data/Cargo.toml",
      "size": 437,
      "sha256": "a284129091841b5742e0ea5b6eeb5fff924cbc4f1eed059bfd075af5256ecb80"
    },
    {
      "path": "crates/qpls-data/src/lib.rs",
      "size": 44865,
      "sha256": "a1cab41fc8c82a71dbf7ee674f037040009c0e8340976b98a9ebcfc99851a7e1"
    },
    {
      "path": "crates/qpls-estimation/Cargo.toml",
      "size": 503,
      "sha256": "83e71bb5bd14eb64f83f82fe5472f9ab5467d0cb6913fe5e06ee01609393e848"
    },
    {
      "path": "crates/qpls-estimation/examples/cbsem_exact_two_group_configural_metric_validation.rs",
      "size": 9336,
      "sha256": "04c2562837a3f3e72536bfa271e6c6a764c26472ff30c64f9c9447152d92d210"
    },
    {
      "path": "crates/qpls-estimation/src/cbsem_bootstrap_contract.rs",
      "size": 39817,
      "sha256": "a603bb2fbf2dc6da62fd7d80b10df72fd6f34375b4ad91103a6d847d706c48e9"
    },
    {
      "path": "crates/qpls-estimation/src/cbsem_exact_nested_lrt.rs",
      "size": 67546,
      "sha256": "c7915c1e752a36f8921998f724f3e5326bceff3f26914dd940d6653c3de1b458"
    },
    {
      "path": "crates/qpls-estimation/src/cbsem_exact_parameter_table.rs",
      "size": 168802,
      "sha256": "154ba1fe5c2b6cabfde9f3341dd56938baacd09f1d7a3aee3e02b8ec6dbba35a"
    },
    {
      "path": "crates/qpls-estimation/src/cbsem_exact_two_group_invariance.rs",
      "size": 79989,
      "sha256": "0669b95dc809fca986892ec448389d9b60fb545631c43743b8802ddc237ccb52"
    },
    {
      "path": "crates/qpls-estimation/src/cbsem_matrix_input.rs",
      "size": 203747,
      "sha256": "776c25cad34760de2caeb69d57913a488defeaaad9abdc7c4ada929b1ad276e9"
    },
    {
      "path": "crates/qpls-estimation/src/cbsem_product_indicator_moderation.rs",
      "size": 67605,
      "sha256": "27d5486b0c041ef4fadb2aa8a6a7619b129d145c6ef288d874fa99710345bcc4"
    },
    {
      "path": "crates/qpls-estimation/src/continuous_raw_mean_replacement_v1.rs",
      "size": 55129,
      "sha256": "f27f000f766c27981cf9005008a875030dc87dd2bf8d98925604a5275a9ce8fd"
    },
    {
      "path": "crates/qpls-estimation/src/general_sem_pls_interactions_v1.rs",
      "size": 54795,
      "sha256": "7a5d4753f1aafc0cc3057a855f0671b5b1dc680034c1cda4f97e7c00579f418c"
    },
    {
      "path": "crates/qpls-estimation/src/lib.rs",
      "size": 860,
      "sha256": "54c42d786890dca139b7ba42b2b2d8d8d3a6d74a58403345713f03d103a196aa"
    },
    {
      "path": "crates/qpls-estimation/src/pls.rs",
      "size": 808499,
      "sha256": "dc8c24e15255a38db77421c0d27bca6fbf202da3b0082499de6474b537d94df9"
    },
    {
      "path": "crates/qpls-estimation/src/pls_model_comparison.rs",
      "size": 77127,
      "sha256": "880a9d25c3c19ce175706f8325e42fdc00b0c2b28896ddcd7ff2ca37b4b930f6"
    },
    {
      "path": "crates/qpls-project/Cargo.toml",
      "size": 870,
      "sha256": "d51f1e2ae30b436bac003892103f05f9cef80ae7956b3a3cbfc3c22e16506fa6"
    },
    {
      "path": "crates/qpls-project/src/archive_integrity.rs",
      "size": 31085,
      "sha256": "f4eeb463e56b01937f4a77eed863cd3c90a142f973a8f378d5ddd591fac79b5a"
    },
    {
      "path": "crates/qpls-project/src/canonical_result_document_v2.rs",
      "size": 65389,
      "sha256": "5a1e39a2c990c362a1c3e2721de713b2add8cf93982f914a9cc3ade335a50700"
    },
    {
      "path": "crates/qpls-project/src/data_lineage_v1.rs",
      "size": 41942,
      "sha256": "db0ed93df87c78483ae5114f0c275ecbcba016ed1cd7d35715efc34708982afa"
    },
    {
      "path": "crates/qpls-project/src/lib.rs",
      "size": 854912,